mid,name,description,region,released_date,poster,director,rating,votecount
206647,Spectre,A Plan No One Escapes,"United Kingdom, United States of America",2015-10-26,posters/19995_avatar.jpg,39,4466,6.3
209112,Batman v Superman: Dawn of Justice,Justice or revenge,United States of America,2016-03-23,posters/19995_avatar.jpg,15217,7004,5.7
228161,Home,Worlds Collide,United States of America,2015-03-18,posters/19995_avatar.jpg,52870,1519,6.8
241259,Alice Through the Looking Glass,It's time for a little madness.,"United Kingdom, United States of America",2016-05-25,posters/19995_avatar.jpg,26205,1725,6.5
246655,X-Men: Apocalypse,Only the strong will survive,United States of America,2016-05-18,posters/19995_avatar.jpg,9032,4721,6.4
258489,The Legend of Tarzan,Human. Nature.,"Canada, United Kingdom, United States of America",2016-06-29,posters/19995_avatar.jpg,11343,2430,5.5
266647,Pan,Every legend has a beginning.,United States of America,2015-09-24,posters/19995_avatar.jpg,36588,954,5.9
267935,The BFG,The world is more giant than you can imagine.,"India, United States of America",2016-06-01,posters/19995_avatar.jpg,488,1000,6
270946,Penguins of Madagascar,The Movie Event That Will Blow Their Cover,United States of America,2014-11-22,posters/19995_avatar.jpg,18863,1346,6.5
271110,Captain America: Civil War,Divided We Fall,United States of America,2016-04-27,posters/19995_avatar.jpg,19271,7241,7.1
278927,The Jungle Book,,"United Kingdom, United States of America",2016-04-07,posters/19995_avatar.jpg,15277,2892,6.7
281957,The Revenant,"(n. One who has returned, as if from the dead.)","Canada, Hong Kong, Taiwan, United States of America",2015-12-25,posters/19995_avatar.jpg,223,6396,7.3
297761,Suicide Squad,Worst Heroes Ever,United States of America,2016-08-02,posters/19995_avatar.jpg,19769,7458,5.9
315011,シン・ゴジラ,A god incarnate. A city doomed.,Japan,2016-07-29,posters/19995_avatar.jpg,77921,143,6.5
417859,Puss in Boots,Live for danger. Fight for justice. Pray for mercy.,United States of America,2011-10-28,posters/19995_avatar.jpg,12098,451,6.4
